,position,link,title,source,date,snippet,thumbnail
0,1,https://www.teslarati.com/tesla-model-s-plaid-totaled-by-service-center-employee-leaving-owner-without-answers/,"Tesla Model S Plaid totaled by Service Center employee, leaving owner without answers",Teslarati,1 hour ago,"A $155,000 Tesla Model S Plaid was totaled several days after the owner 
dropped the vehicle off for a Service appointment.",https://serpapi.com/searches/6317ac45af5af1c0b7913df2/images/16b5e4d0193920d910d6111c67d01693c7ad3a5b115c412a73654fc0ff53101d.jpeg
1,2,https://www.cnn.com/videos/business/2022/09/05/norwegian-tesla-owner-hunger-strike-orig-ht.cnn-business,These Tesla owners are going to great lengths to get Elon Musk's attention,CNN,1 day ago,"A group of dissatisfied Norwegian Tesla owners performed a stunt in hopes 
that Elon Musk would see their message from space.",https://serpapi.com/searches/6317ac45af5af1c0b7913df2/images/16b5e4d0193920d9ce7e0a1161324f9088672731b3d95d1c0431c7e0d12fee89.jpeg
2,3,https://www.notateslaapp.com/software-updates/version/2022.28/release-notes,2022.28 Official Tesla Release Notes - Software Updates,Not a Tesla App,3 days ago,"Your vehicle is now running Tesla Vision! It will rely on camera vision 
coupled with neural net processing to deliver certain Autopilot and...",https://serpapi.com/searches/6317ac45af5af1c0b7913df2/images/16b5e4d0193920d928f0d546a6dc2e553b540534dc91ea6bbecefd1ee8fe295f.png
3,4,https://www.barrons.com/articles/tesla-debt-rating-moodys-51662387747,Tesla's Debt Won't Get Upgraded Until This Happens,Barron's,1 day ago,"Tesla CEO Elon Musk doesn't appear to care that ratings firms haven't 
upgraded debt in his company to investment-grade levels yet.",https://serpapi.com/searches/6317ac45af5af1c0b7913df2/images/16b5e4d0193920d99b257a653b6170a17de42e79c22f4511f7ff18dac0fb29e9.jpeg
4,5,https://insideevs.com/news/608499/three-tesla-semi-spotted-together/,Report: Three Tesla Semis Spotted Together,InsideEVs,8 hours ago,"As the market launch of the Tesla Semi nears (finally), Tesla followers 
reports that the electric Semi prototype sightings are becoming more...",https://serpapi.com/searches/6317ac45af5af1c0b7913df2/images/16b5e4d0193920d9374fcd8347da795dff1626fcfc99524521ec884ebe8f3912.jpeg
5,6,https://www.caranddriver.com/features/columns/a40934669/ezra-dyer-teslas-new-reality/,Ezra Dyer: Tesla's New Reality,Car and Driver,3 days ago,"Once the unrivaled leader in electric vehicles, Tesla seems unconcerned 
that the Supercharger network is its last big advantage.",https://serpapi.com/searches/6317ac45af5af1c0b7913df2/images/16b5e4d0193920d9509ee9e8a2c33b063a4a1178af8a14556138d04ded5ea202.jpeg
6,7,https://www.barrons.com/articles/moodys-doesnt-want-to-upgrade-tesla-debt-51662387747,Moody's Doesn't Want To Upgrade Tesla Debt Until This Happens.,Barron's,1 day ago,"Tesla CEO Elon Musk doesn't appear to care that ratings agencies haven't 
upgraded debt in his company to investment grade levels yet.",https://serpapi.com/searches/6317ac45af5af1c0b7913df2/images/16b5e4d0193920d99702c9020bc500c5e040a72f3071ea2f3d65de3977e7ad5e.jpeg
